<?xml version="1.0" encoding="utf-8"?>
<!DOCTYPE testrun SYSTEM "../testrun.dtd">
<testrun description="UpgradeTest (alle Tests)">
	<environment>
		<os> </os>
		<bit> </bit>
		<platform> </platform>
	</environment>
	<testrow> <!-- 7.3.00 auf 7.3.00 -->
		<version role="source-start"><versionnumber>7.3.00.36</versionnumber></version>
		<version role="source-end"><versionnumber>7.3.00.45</versionnumber></version>
		<version role="target"><versionnumber>7.3.00.46</versionnumber></version>
		<version role="brick"><versionnumber>7.4.02.10</versionnumber></version>
		<instprofile>Server</instprofile>
		<database>
			<type>OLTP</type>
			<script task="createdb">
				<path>f7300t7403/createdb.script</path>
			</script>
			<script task="prepupdate">
				<path>f7300t7403/prepupdate.script</path>
				<dbm>
					<property name="dbname" value="TESTDB"/>
				</dbm>
			</script>
			<script task="prepuninst">
				<path>f7300t7403/prepuninst.script</path>
				<dbm>
					<property name="dbname" value="TESTDB"/>
				</dbm>
			</script>
		</database>
	</testrow>
	<testrow> <!-- 7.3.00 auf 7.4.03 -->
		<version role="source-start"><versionnumber>7.3.00.36</versionnumber></version>
		<version role="source-end"><versionnumber>7.3.00.46</versionnumber></version>
		<version role="target"><versionnumber state="DEV">7.4.03</versionnumber></version>
		<version role="brick"><versionnumber>7.4.02.10</versionnumber></version>
		<instprofile>Server</instprofile>
		<database>
			<type>OLTP</type>
			<script task="createdb">
				<path>f7300t7403/createdb.script</path>
			</script>
			<script task="prepupdate">
				<path>f7300t7403/prepupdate.script</path>
				<dbm>
					<property name="dbname" value="TESTDB"/>
				</dbm>
			</script>
			<script task="prepuninst">
				<path>f7300t7403/prepuninst.script</path>
				<dbm>
					<property name="dbname" value="TESTDB"/>
				</dbm>
			</script>
		</database>
	</testrow>
	<testrow> <!-- 7.3.00 auf 7.5.00 -->
		<version role="source-start"><versionnumber>7.3.00.36</versionnumber></version>
		<version role="source-end"><versionnumber>7.3.00.46</versionnumber></version>
		<version role="target"><versionnumber state="DEV">7.5.00</versionnumber></version>
		<version role="brick"><versionnumber>7.4.02.10</versionnumber></version>
		<instprofile>Server</instprofile>
		<database>
			<type>OLTP</type>
			<script task="createdb">
				<path>f7300t7403/createdb.script</path>
			</script>
			<script task="prepupdate">
				<path>f7300t7403/prepupdate.script</path>
				<dbm>
					<property name="dbname" value="TESTDB"/>
				</dbm>
			</script>
			<script task="prepuninst">
				<path>f7300t7403/prepuninst.script</path>
				<dbm>
					<property name="dbname" value="TESTDB"/>
				</dbm>
			</script>
		</database>
	</testrow>
	<!--testrow> <!- 7.4.02 auf 7.4.02 ->
		<version role="source-start"><versionnumber>7.4.02.08</versionnumber></version>
		<version role="source-end"><versionnumber>7.4.02.23</versionnumber></version>
		<version role="target"><versionnumber state="DEV">7.4.02</versionnumber></version>
		<version role="brick"><versionnumber>7.4.03.10</versionnumber></version>
		<instprofile>Server</instprofile>
		<database>
			<type>OLTP</type>
			<script task="createdb">
				<path>f7403t7403/createdb.script</path>
			</script>
			<script task="prepupdate">
				<path>f7403t7403/prepupdate.script</path>
				<dbm>
					<property name="dbname" value="TESTDB"/>
				</dbm>
			</script>
			<script task="prepuninst">
				<path>f7403t7403/prepuninst.script</path>
				<dbm>
					<property name="dbname" value="TESTDB"/>
				</dbm>
			</script>
		</database>
	</testrow>
	<testrow> <!- 7.4.02 auf 7.4.03 ->
		<version role="source-start"><versionnumber>7.4.02.08</versionnumber></version>
		<version role="source-end"><versionnumber>7.4.02.23</versionnumber></version>
		<version role="target"><versionnumber state="DEV">7.4.03</versionnumber></version>
		<version role="brick"><versionnumber>7.4.03.11</versionnumber></version>
		<instprofile>Server</instprofile>
		<database>
			<type>OLTP</type>
			<script task="createdb">
				<path>f7403t7403/createdb.script</path>
			</script>
			<script task="prepupdate">
				<path>f7403t7403/prepupdate.script</path>
				<dbm>
					<property name="dbname" value="TESTDB"/>
				</dbm>
			</script>
			<script task="prepuninst">
				<path>f7403t7403/prepuninst.script</path>
				<dbm>
					<property name="dbname" value="TESTDB"/>
				</dbm>
			</script>
		</database>
	</testrow>
	<testrow> <!- 7.4.02 auf 7.5.00 ->
		<version role="source-start"><versionnumber>7.4.02.08</versionnumber></version>
		<version role="source-end"><versionnumber>7.4.02.23</versionnumber></version>
		<version role="target"><versionnumber state="DEV">7.5.00</versionnumber></version>
		<version role="brick"><versionnumber>7.5.00.02</versionnumber></version>
		<instprofile>Server</instprofile>
		<database>
			<type>OLTP</type>
			<script task="createdb">
				<path>f7403t7403/createdb.script</path>
			</script>
			<script task="prepupdate">
				<path>f7403t7403/prepupdate.script</path>
				<dbm>
					<property name="dbname" value="TESTDB"/>
				</dbm>
			</script>
			<script task="prepuninst">
				<path>f7403t7403/prepuninst.script</path>
				<dbm>
					<property name="dbname" value="TESTDB"/>
				</dbm>
			</script>
		</database>
	</testrow-->
	<testrow> <!-- 7.4.03 auf 7.4.03 -->
		<version role="source-start"><versionnumber>7.4.03.07</versionnumber></version>
		<version role="source-end"><versionnumber>7.4.03.31</versionnumber></version>
		<version role="target"><versionnumber state="DEV">7.4.03</versionnumber></version>
		<version role="brick"><versionnumber>7.5.00.02</versionnumber></version>
		<instprofile>Server</instprofile>
		<database>
			<type>OLTP</type>
			<script task="createdb">
				<path>f7403t7403/createdb.script</path>
			</script>
			<script task="prepupdate">
				<path>f7403t7403/prepupdate.script</path>
				<dbm>
					<property name="dbname" value="TESTDB"/>
				</dbm>
			</script>
			<script task="prepuninst">
				<path>f7403t7403/prepuninst.script</path>
				<dbm>
					<property name="dbname" value="TESTDB"/>
				</dbm>
			</script>
		</database>
	</testrow>
	<testrow> <!-- 7.4.03 auf 7.5.00 -->
		<version role="source-start"><versionnumber>7.4.03.07</versionnumber></version>
		<version role="source-end"><versionnumber>7.4.03.31</versionnumber></version>
		<version role="target"><versionnumber state="DEV">7.5.00</versionnumber></version>
		<version role="brick"><versionnumber>7.5.00.02</versionnumber></version>
		<instprofile>Server</instprofile>
		<database>
			<type>OLTP</type>
			<script task="createdb">
				<path>f7403t7403/createdb.script</path>
			</script>
			<script task="prepupdate">
				<path>f7403t7403/prepupdate.script</path>
				<dbm>
					<property name="dbname" value="TESTDB"/>
				</dbm>
			</script>
			<script task="prepuninst">
				<path>f7403t7403/prepuninst.script</path>
				<dbm>
					<property name="dbname" value="TESTDB"/>
				</dbm>
			</script>
		</database>
	</testrow>
	<testrow> <!-- 7.5.00 auf 7.5.00 -->
		<version role="source-start"><versionnumber>7.5.00.03</versionnumber></version>
		<version role="source-end"><versionnumber>7.5.00.11</versionnumber></version>
		<version role="target"><versionnumber state="DEV">7.5.00</versionnumber></version>
		<version role="brick"><versionnumber>7.5.00.02</versionnumber></version>
		<instprofile>Server</instprofile>
		<database>
			<type>OLTP</type>
			<script task="createdb">
				<path>f7500t7500/createdb.script</path>
			</script>
			<script task="prepupdate">
				<path>f7500t7500/prepupdate.script</path>
				<dbm>
					<property name="dbname" value="TESTDB"/>
				</dbm>
			</script>
			<script task="prepuninst">
				<path>f7500t7500/prepuninst.script</path>
				<dbm>
					<property name="dbname" value="TESTDB"/>
				</dbm>
			</script>
		</database>
	</testrow>
</testrun>