<?xml version="1.0" encoding="utf-8"?>
<!DOCTYPE testrun SYSTEM "../testrun.dtd">
<testrun description="UpgradeTest">
	<environment>
		<os> </os>
		<bit> </bit>
		<platform> </platform>
	</environment>
	<test>
		<version role="source"><versionnumber>7.4.03.24</versionnumber></version>
		<version role="target"><versionnumber state="DEV">7.5.00</versionnumber></version>
		<instprofile>Server</instprofile>
		<updateNewSecurityConceptBackup/>
		<database>
			<type>OLTP</type>
			<script task="createdb">
				<path>scripts/createdb_74.script</path>
			</script>
			<script task="prepupdate">
				<path>scripts/nothing.script</path>
				<dbm>
					<property name="dbname" value="TESTDB"/>
				</dbm>
			</script>
			<script task="prepuninst">
				<path>scripts/dbdrop.script</path>
				<dbm>
					<property name="dbname" value="TESTDB"/>
				</dbm>
			</script>
		</database>
		<stop after="updateDB" when="failed" method="hold"/>
	</test>
</testrun>

